{
  "schemaId": "regelsuche.discovery-evidence/v1",
  "profiles": ["observed"],
  "producer": {
    "producerId": "docs-example",
    "producerVersion": "1",
    "implementation": "example",
    "sourceRef": "docs",
    "schemaPath": "docs/schemas/regelsuche.discovery-evidence-v1.schema.json",
    "extensions": {}
  },
  "subject": {
    "id": "example-observed",
    "kind": "DISCOVERY_SCENARIO",
    "title": "Observed example",
    "inputExpression": "a+b",
    "targetExpression": "b+a",
    "extensions": {}
  },
  "claims": [
    {
      "id": "claim-1",
      "kind": "GENERATED_SUMMARY",
      "outcome": "SUPPORTED",
      "statement": "Observed rewrite candidate.",
      "evidenceRefs": ["observation-1"],
      "extensions": {}
    }
  ],
  "observations": [
    {
      "id": "observation-1",
      "kind": "SEARCH_TRACE",
      "outcome": "OBSERVED",
      "pathCount": 1,
      "nodeCount": 2,
      "edgeCount": 1,
      "bridgeRulesUsed": [],
      "learnedMacros": [],
      "reusedMacros": [],
      "validationStatus": "PASS",
      "sourceFields": ["nodes"],
      "extensions": {}
    }
  ],
  "generalizedHypothesis": {
    "statement": "Commutativity candidate.",
    "family": "commutativity",
    "rulePath": [],
    "status": "INCONCLUSIVE",
    "extensions": {}
  },
  "revisions": [],
  "assumptions": [],
  "counterexamples": [],
  "holdouts": [],
  "oracleResults": [],
  "provenance": {},
  "novelty": {
    "status": "UNKNOWN",
    "matchedEvidenceIds": [],
    "rationale": "Example only.",
    "extensions": {}
  },
  "ablation": {
    "kind": "ABLATION_STUDY",
    "status": "N/A",
    "outcome": "INCONCLUSIVE",
    "improvementRatio": 0.0,
    "withCandidate": {
      "success": null,
      "pathLength": -1,
      "statesExplored": -1
    },
    "withoutCandidate": {
      "success": null,
      "pathLength": -1,
      "statesExplored": -1
    },
    "explanation": "Not measured yet.",
    "extensions": {}
  },
  "proof": {
    "required": false,
    "policy": "OPTIONAL",
    "outcome": "NOT_REQUESTED",
    "confirmations": [],
    "extensions": {}
  },
  "promotion": {
    "status": "OBSERVED",
    "eligible": false,
    "gateAccepted": false,
    "gateId": "none",
    "rejectionReasons": [],
    "extensions": {}
  },
  "artifacts": [],
  "extensions": {}
}
